doi,domain,problem,title,abstract,label
10.1109/TVCG.2014.2346911,['societal threats'],['simulation model'],VASA: Interactive Computational Steering of Large Asynchronous Simulation Pipelines for Societal Infrastructure,"We present VASA, a visual analytics platform consisting of a desktop application, a component model, and a suite of distributed simulation components for modeling the impact of societal threats such as weather, food contamination, and traffic on critical infrastructure such as supply chains, road networks, and power grids. Each component encapsulates a high-fidelity simulation model that together form an asynchronous simulation pipeline: a system of systems of individual simulations with a common data and parameter exchange format. At the heart of VASA is the Workbench, a visual analytics application providing three distinct features: (1) low-fidelity approximations of the distributed simulation components using local simulation proxies to enable analysts to interactively configure a simulation run; (2) computational steering mechanisms to manage the execution of individual simulation components; and (3) spatiotemporal and interactive methods to explore the combined results of a simulation run. We showcase the utility of the platform using examples involving supply chains during a hurricane as well as food contamination in a fast food restaurant chain.",1.0
10.1109/TVCG.2014.2346922,['social media'],"['anomalous information spreading', 'anomaly detection']",#FluxFlow: Visual Analysis of Anomalous Information Spreading on Social Media,"We present FluxFlow, an interactive visual analysis system for revealing and analyzing anomalous information spreading in social media. Everyday, millions of messages are created, commented, and shared by people on social media websites, such as Twitter and Facebook. This provides valuable data for researchers and practitioners in many application domains, such as marketing, to inform decision-making. Distilling valuable social signals from the huge crowd's messages, however, is challenging, due to the heterogeneous and dynamic crowd behaviors. The challenge is rooted in data analysts' capability of discerning the anomalous information behaviors, such as the spreading of rumors or misinformation, from the rest that are more conventional patterns, such as popular topics and newsworthy events, in a timely fashion. FluxFlow incorporates advanced machine learning algorithms to detect anomalies, and offers a set of novel visualization designs for presenting the detected threads for deeper analysis. We evaluated FluxFlow with real datasets containing the Twitter feeds captured during significant events such as Hurricane Sandy. Through quantitative measurements of the algorithmic performance and qualitative interviews with domain experts, the results show that the back-end anomaly detection model is effective in identifying anomalous retweeting threads, and its front-end interactive visualizations are intuitive and useful for analysts to discover insights in data and comprehend the underlying analytical model.",1.0
10.1109/VAST.2014.7042478,"['sports', 'baseball', 'baseball analyses']",[],Baseball4D: A tool for baseball game reconstruction & visualization,"While many sports use statistics and video to analyze and improve game play, baseball has led the charge throughout its history. With the advent of new technologies that allow all players and the ball to be tracked across the entire field, it is now possible to bring this understanding to another level. From discrete positions across time, we present techniques to reconstruct entire baseball games and visually explore each play. This provides opportunities to not only derive new metrics for the game, but also allow us to investigate existing measures with targeted visualizations. In addition, our techniques allow users to filter on demand so specific situations can be analyzed both in general and according to those situations. We show that gameplay can be accurately reconstructed from the raw position data and discuss how visualization and statistical methods can combine to better inform baseball analyses.",1.0
10.1109/VAST.2014.7042489,"['climate', 'climate change']",[],Vismate: Interactive visual analysis of station-based observation data on climate changes,"We present a new approach to visualizing the climate data of multi-dimensional, time-series, and geo-related characteristics. Our approach integrates three new highly interrelated visualization techniques, and uses the same input data types as in the traditional model-based analysis methods. As the main visualization view, Global Radial Map is used to identify the overall state of climate changes and provide users with a compact and intuitive view for analyzing spatial and temporal patterns at the same time. Other two visualization techniques, providing complementary views, are specialized in analysing time trend and detecting abnormal cases, which are two important analysis tasks in any climate change study. Case studies and expert reviews have been conducted, through which the effectiveness and scalability of the proposed approach has been confirmed.",1.0
10.1109/VAST.2014.7042495,[],"['model building', 'predictive analysis']",Integrating predictive analytics and social media,"A key analytical task across many domains is model building and exploration for predictive analysis. Data is collected, parsed and analyzed for relationships, and features are selected and mapped to estimate the response of a system under exploration. As social media data has grown more abundant, data can be captured that may potentially represent behavioral patterns in society. In turn, this unstructured social media data can be parsed and integrated as a key factor for predictive intelligence. In this paper, we present a framework for the development of predictive models utilizing social media data. We combine feature selection mechanisms, similarity comparisons and model cross-validation through a variety of interactive visualizations to support analysts in model building and prediction. In order to explore how predictions might be performed in such a framework, we present results from a user study focusing on social media data as a predictor for movie box-office success.",0.0
10.1109/TVCG.2015.2467592,['public transportation'],[],Visually Exploring Transportation Schedules,"Public transportation schedules are designed by agencies to optimize service quality under multiple constraints. However, real service usually deviates from the plan. Therefore, transportation analysts need to identify, compare and explain both eventual and systemic performance issues that must be addressed so that better timetables can be created. The purely statistical tools commonly used by analysts pose many difficulties due to the large number of attributes at tripand station-level for planned and real service. Also challenging is the need for models at multiple scales to search for patterns at different times and stations, since analysts do not know exactly where or when relevant patterns might emerge and need to compute statistical summaries for multiple attributes at different granularities. To aid in this analysis, we worked in close collaboration with a transportation expert to design TR-EX, a visual exploration tool developed to identify, inspect and compare spatio-temporal patterns for planned and real transportation service. TR-EX combines two new visual encodings inspired by Marey's Train Schedule: Trips Explorer for trip-level analysis of frequency, deviation and speed; and Stops Explorer for station-level study of delay, wait time, reliability and performance deficiencies such as bunching. To tackle overplotting and to provide a robust representation for a large numbers of trips and stops at multiple scales, the system supports variable kernel bandwidths to achieve the level of detail required by users for different tasks. We justify our design decisions based on specific analysis needs of transportation analysts. We provide anecdotal evidence of the efficacy of TR-EX through a series of case studies that explore NYC subway service, which illustrate how TR-EX can be used to confirm hypotheses and derive new insights through visual exploration.",1.0
10.1109/TVCG.2015.2467618,[],"['topic modeling', 'model comparison', 'text visualization']",Task-Driven Comparison of Topic Models,"Topic modeling, a method of statistically extracting thematic content from a large collection of texts, is used for a wide variety of tasks within text analysis. Though there are a growing number of tools and techniques for exploring single models, comparisons between models are generally reduced to a small set of numerical metrics. These metrics may or may not reflect a model's performance on the analyst's intended task, and can therefore be insufficient to diagnose what causes differences between models. In this paper, we explore task-centric topic model comparison, considering how we can both provide detail for a more nuanced understanding of differences and address the wealth of tasks for which topic models are used. We derive comparison tasks from single-model uses of topic models, which predominantly fall into the categories of understanding topics, understanding similarity, and understanding change. Finally, we provide several visualization techniques that facilitate these tasks, including buddy plots, which combine color and position encodings to allow analysts to readily view changes in document similarity.",0.0
10.1109/TVCG.2015.2467733,"['clinical diagnosis', 'comparison of phenotypes', 'phenotypic reporting']",[],PhenoBlocks: Phenotype Comparison Visualizations,"The differential diagnosis of hereditary disorders is a challenging task for clinicians due to the heterogeneity of phenotypes that can be observed in patients. Existing clinical tools are often text-based and do not emphasize consistency, completeness, or granularity of phenotype reporting. This can impede clinical diagnosis and limit their utility to genetics researchers. Herein, we present PhenoBlocks, a novel visual analytics tool that supports the comparison of phenotypes between patients, or between a patient and the hallmark features of a disorder. An informal evaluation of PhenoBlocks with expert clinicians suggested that the visualization effectively guides the process of differential diagnosis and could reinforce the importance of complete, granular phenotypic reporting.",1.0
10.1109/TVCG.2015.2467931,[],"['casual discovery', 'causal reasoning']",The Visual Causality Analyst: An Interactive Interface for Causal Reasoning,"Uncovering the causal relations that exist among variables in multivariate datasets is one of the ultimate goals in data analytics. Causation is related to correlation but correlation does not imply causation. While a number of casual discovery algorithms have been devised that eliminate spurious correlations from a network, there are no guarantees that all of the inferred causations are indeed true. Hence, bringing a domain expert into the casual reasoning loop can be of great benefit in identifying erroneous casual relationships suggested by the discovery algorithm. To address this need we present the Visual Causal Analyst - a novel visual causal reasoning framework that allows users to apply their expertise, verify and edit causal links, and collaborate with the causal discovery algorithm to identify a valid causal network. Its interface consists of both an interactive 2D graph view and a numerical presentation of salient statistical parameters, such as regression coefficients, p-values, and others. Both help users in gaining a good understanding of the landscape of causal structures particularly when the number of variables is large. Our framework is also novel in that it can handle both numerical and categorical variables within one unified model and return plausible results. We demonstrate its use via a set of case studies using multiple practical datasets.",0.0
10.1109/VAST.2015.7347629,[],"['activity recognition', 'parameter tuning']",Supporting activity recognition by visual analytics,"Recognizing activities has become increasingly relevant in many application domains, such as security or ambient assisted living. To handle different scenarios, the underlying automated algorithms are configured using multiple input parameters. However, the influence and interplay of these parameters is often not clear, making exhaustive evaluations necessary. On this account, we propose a visual analytics approach to supporting users in understanding the complex relationships among parameters, recognized activities, and associated accuracies. First, representative parameter settings are determined. Then, the respective output is computed and statistically analyzed to assess parameters' influence in general. Finally, visualizing the parameter settings along with the activities provides overview and allows to investigate the computed results in detail. Coordinated interaction helps to explore dependencies, compare different settings, and examine individual activities. By integrating automated, visual, and interactive means users can select parameter values that meet desired quality criteria. We demonstrate the application of our solution in a use case with realistic complexity, involving a study of human protagonists in daily living with respect to hundreds of parameter settings.",0.0
10.1109/VAST.2015.7347634,[],['comparative exploration of 2d vector-valued ensemble ﬁelds'],Comparative visual analysis of vector field ensembles,"We present a new visual analysis approach to support the comparative exploration of 2D vector-valued ensemble fields. Our approach enables the user to quickly identify the most similar groups of ensemble members, as well as the locations where the variation among the members is high. We further provide means to visualize the main features of the potentially multimodal directional distributions at user-selected locations. For this purpose, directional data is modelled using mixtures of probability density functions (pdfs), which allows us to characterize and classify complex distributions with relatively few parameters. The resulting mixture models are used to determine the degree of similarity between ensemble members, and to construct glyphs showing the direction, spread, and strength of the principal modes of the directional distributions. We also propose several similarity measures, based on which we compute pairwise member similarities in the spatial domain and form clusters of similar members. The hierarchical clustering is shown using dendrograms and similarity matrices, which can be used to select particular members and visualize their variations. A user interface providing multiple linked views enables the simultaneous visualization of aggregated global and detailed local variations, as well as the selection of members for a detailed comparison.",0.0
10.1109/TVCG.2016.2598416,"['taxi trajectory', 'transportation', 'urban planning']",[],SemanticTraj: A New Approach to Interacting with Massive Taxi Trajectories,"Massive taxi trajectory data is exploited for knowledge discovery in transportation and urban planning. Existing tools typically require users to select and brush geospatial regions on a map when retrieving and exploring taxi trajectories and passenger trips. To answer seemingly simple questions such as “What were the taxi trips starting from Main Street and ending at Wall Street in the morning?” or “Where are the taxis arriving at the Art Museum at noon typically coming from?”, tedious and time consuming interactions are usually needed since the numeric GPS points of trajectories are not directly linked to the keywords such as “Main Street”, “Wall Street”, and “Art Museum”. In this paper, we present SemanticTraj, a new method for managing and visualizing taxi trajectory data in an intuitive, semantic rich, and efficient means. With SemanticTraj, domain and public users can find answers to the aforementioned questions easily through direct queries based on the terms. They can also interactively explore the retrieved data in visualizations enhanced by semantic information of the trajectories and trips. In particular, taxi trajectories are converted into taxi documents through a textualization transformation process. This process maps GPS points into a series of street/POI names and pick-up/drop-off locations. It also converts vehicle speeds into user-defined descriptive terms. Then, a corpus of taxi documents is formed and indexed to enable flexible semantic queries over a text search engine. Semantic labels and meta-summaries of the results are integrated with a set of visualizations in a SemanticTraj prototype, which helps users study taxi trajectories quickly and easily. A set of usage scenarios are presented to show the usability of the system. We also collected feedback from domain experts and conducted a preliminary user study to evaluate the visual system.",1.0
10.1109/TVCG.2016.2598472,['human brain networks'],[],Blockwise Human Brain Network Visual Comparison Using NodeTrix Representation,"Visually comparing human brain networks from multiple population groups serves as an important task in the field of brain connectomics. The commonly used brain network representation, consisting of nodes and edges, may not be able to reveal the most compelling network differences when the reconstructed networks are dense and homogeneous. In this paper, we leveraged the block information on the Region Of Interest (ROI) based brain networks and studied the problem of blockwise brain network visual comparison. An integrated visual analytics framework was proposed. In the first stage, a two-level ROI block hierarchy was detected by optimizing the anatomical structure and the predictive comparison performance simultaneously. In the second stage, the NodeTrix representation was adopted and customized to visualize the brain network with block information. We conducted controlled user experiments and case studies to evaluate our proposed solution. Results indicated that our visual analytics method outperformed the commonly used node-link graph and adjacency matrix design in the blockwise network comparison tasks. We have shown compelling findings from two real-world brain network data sets, which are consistent with the prior connectomics studies.",1.0
10.1109/TVCG.2016.2598797,"['web clickstream', 'clickstream analysis']",['sequence mining'],Patterns and Sequences: Interactive Exploration of Clickstreams to Understand Common Visitor Paths,"Modern web clickstream data consists of long, high-dimensional sequences of multivariate events, making it difficult to analyze. Following the overarching principle that the visual interface should provide information about the dataset at multiple levels of granularity and allow users to easily navigate across these levels, we identify four levels of granularity in clickstream analysis: patterns, segments, sequences and events. We present an analytic pipeline consisting of three stages: pattern mining, pattern pruning and coordinated exploration between patterns and sequences. Based on this approach, we discuss properties of maximal sequential patterns, propose methods to reduce the number of patterns and describe design considerations for visualizing the extracted sequential patterns and the corresponding raw sequences. We demonstrate the viability of our approach through an analysis scenario and discuss the strengths and limitations of the methods based on user feedback.",1.0
10.1109/TVCG.2016.2598838,[],['artiﬁcial neural networks'],Visualizing the Hidden Activity of Artificial Neural Networks,"In machine learning, pattern classification assigns high-dimensional vectors (observations) to classes based on generalization from examples. Artificial neural networks currently achieve state-of-the-art results in this task. Although such networks are typically used as black-boxes, they are also widely believed to learn (high-dimensional) higher-level representations of the original observations. In this paper, we propose using dimensionality reduction for two tasks: visualizing the relationships between learned representations of observations, and visualizing the relationships between artificial neurons. Through experiments conducted in three traditional image classification benchmark datasets, we show how visualization can provide highly valuable feedback for network designers. For instance, our discoveries in one of these datasets (SVHN) include the presence of interpretable clusters of learned representations, and the partitioning of artificial neurons into groups with apparently related discriminative roles.",0.0
10.1109/VAST.2016.7883509,"['hiv  vaccine', 'immune system']",[],The DataSpace for HIV vaccine studies,"The DataSpace for HIV vaccine studies is a discovery tool available on the web to hundreds of investigators. We designed it to help them better understand activity in the field and explore new ideas latent in completed research. The DataSpace harmonizes immunoassay results and study metadata so that a broader research community can pursue more flexible discovery than the typical centrally planned analyses. Insights from human-centered design and beta evaluation suggest strong potential for visual analytics that may also apply to other efforts in open science. The contribution of this paper is to elucidate key domain challenges and demonstrate an application that addresses them. We made several changes to familiar visualizations to support key tasks such as identifying and filtering to a cohort of interest, making meaningful comparisons of time series data from multiple studies that have different plans, and preserving analytic context when making data transformations and comparisons that would normally exclude some data.",1.0
10.1109/VAST.2016.7883519,[],"['visual query systems', 'time series data', 'sketch-based query']",The semantics of sketch: Flexibility in visual query systems for time series data,"Sketching allows analysts to specify complex and free-form patterns of interest. Visual query systems can make use of sketches to locate these patterns of interest in large datasets. However, sketching is ambiguous: the same drawing could represent a multitude of potential queries. In this work, we investigate these ambiguities as they apply to visual query systems for time series data. We define a class of “invariants” - the properties of a time series that the analyst wishes to ignore when performing a sketch-based query. We present the results of a crowd-sourced study, showing that these invariants are key components of how people rate the strength of match between sketch and target. We adapt a number of algorithms for time series matching to support invariants in sketches. Lastly, we present a web-deployed prototype sketch-based visual query system that relies on these invariants. We apply the prototype to data from finance, the digital humanities, and political science.",0.0
10.1109/TVCG.2017.2744322,[],['trajectory clustering'],Clustering Trajectories by Relevant Parts for Air Traffic Analysis,"Clustering of trajectories of moving objects by similarity is an important technique in movement analysis. Existing distance functions assess the similarity between trajectories based on properties of the trajectory points or segments. The properties may include the spatial positions, times, and thematic attributes. There may be a need to focus the analysis on certain parts of trajectories, i.e., points and segments that have particular properties. According to the analysis focus, the analyst may need to cluster trajectories by similarity of their relevant parts only. Throughout the analysis process, the focus may change, and different parts of trajectories may become relevant. We propose an analytical workflow in which interactive filtering tools are used to attach relevance flags to elements of trajectories, clustering is done using a distance function that ignores irrelevant elements, and the resulting clusters are summarized for further analysis. We demonstrate how this workflow can be useful for different analysis tasks in three case studies with real data from the domain of air traffic. We propose a suite of generic techniques and visualization guidelines to support movement data analysis by means of relevance-aware trajectory clustering.",0.0
10.1109/TVCG.2017.2744458,[],"['analyzing biclusters', 'explore biclusters']",BiDots: Visual Exploration of Weighted Biclusters,"Discovering and analyzing biclusters, i.e., two sets of related entities with close relationships, is a critical task in many real-world applications, such as exploring entity co-occurrences in intelligence analysis, and studying gene expression in bio-informatics. While the output of biclustering techniques can offer some initial low-level insights, visual approaches are required on top of that due to the algorithmic output complexity. This paper proposes a visualization technique, called BiDots, that allows analysts to interactively explore biclusters over multiple domains. BiDots overcomes several limitations of existing bicluster visualizations by encoding biclusters in a more compact and cluster-driven manner. A set of handy interactions is incorporated to support flexible analysis of biclustering results. More importantly, BiDots addresses the cases of weighted biclusters, which has been underexploited in the literature. The design of BiDots is grounded by a set of analytical tasks derived from previous work. We demonstrate its usefulness and effectiveness for exploring computed biclusters with an investigative document analysis task, in which suspicious people and activities are identified from a text corpus.",0.0
