doi,domain,problem,title,abstract,label
10.1109/TVCG.2019.2934656,['presentation videos'],['emotion analysis'],EmoCo: Visual Analysis of Emotion Coherence in Presentation Videos,"Emotions play a key role in human communication and public presentations. Human emotions are usually expressed through multiple modalities. Therefore, exploring multimodal emotions and their coherence is of great value for understanding emotional expressions in presentations and improving presentation skills. However, manually watching and studying presentation videos is often tedious and time-consuming. There is a lack of tool support to help conduct an efficient and in-depth multi-level analysis. Thus, in this paper, we introduce EmoCo, an interactive visual analytics system to facilitate efficient analysis of emotion coherence across facial, text, and audio modalities in presentation videos. Our visualization system features a channel coherence view and a sentence clustering view that together enable users to obtain a quick overview of emotion coherence and its temporal evolution. In addition, a detail view and word view enable detailed exploration and comparison from the sentence level and word level, respectively. We thoroughly evaluate the proposed system and visualization techniques through two usage scenarios based on TED Talk videos and interviews with two domain experts. The results demonstrate the effectiveness of our system in gaining insights into emotion coherence in presentations.",1.0
10.1109/TVCG.2019.2934658,['interactive lighting design'],[],"LightGuider: Guiding Interactive Lighting Design using Suggestions, Provenance, and Quality Visualization","LightGuider is a novel guidance-based approach to interactive lighting design, which typically consists of interleaved 3D modeling operations and light transport simulations. Rather than having designers use a trial-and-error approach to match their illumination constraints and aesthetic goals, LightGuider supports the process by simulating potential next modeling steps that can deliver the most significant improvements. LightGuider takes predefined quality criteria and the current focus of the designer into account to visualize suggestions for lighting-design improvements via a specialized provenance tree. This provenance tree integrates snapshot visualizations of how well a design meets the given quality criteria weighted by the designer's preferences. This integration facilitates the analysis of quality improvements over the course of a modeling workflow as well as the comparison of alternative design solutions. We evaluate our approach with three lighting designers to illustrate its usefulness.",1.0
10.1109/TVCG.2019.2934660,"['quantitative investment', 'portfolio analysis', 'factor investment']",[],sPortfolio: Stratified Visual Analysis of Stock Portfolios,"Quantitative Investment, built on the solid foundation of robust financial theories, is at the center stage in investment industry today. The essence of quantitative investment is the multi-factor model, which explains the relationship between the risk and return of equities. However, the multi-factor model generates enormous quantities of factor data, through which even experienced portfolio managers find it difficult to navigate. This has led to portfolio analysis and factor research being limited by a lack of intuitive visual analytics tools. Previous portfolio visualization systems have mainly focused on the relationship between the portfolio return and stock holdings, which is insufficient for making actionable insights or understanding market trends. In this paper, we present sPortfolio, which, to the best of our knowledge, is the first visualization that attempts to explore the factor investment area. In particular, sPortfolio provides a holistic overview of the factor data and aims to facilitate the analysis at three different levels: a Risk-Factor level, for a general market situation analysis; a Multiple-Portfolio level, for understanding the portfolio strategies; and a Single-Portfolio level, for investigating detailed operations. The system's effectiveness and usability are demonstrated through three case studies. The system has passed its pilot study and is soon to be deployed in industry.",1.0
10.1109/TVCG.2019.2934666,[],"['visual query systems', 'sketch-based interfaces']",You can't always sketch what you want: Understanding Sensemaking in Visual Query Systems,"Visual query systems (VQSs) empower users to interactively search for line charts with desired visual patterns, typically specified using intuitive sketch-based interfaces. Despite decades of past work on VQSs, these efforts have not translated to adoption in practice, possibly because VQSs are largely evaluated in unrealistic lab-based settings. To remedy this gap in adoption, we collaborated with experts from three diverse domains-astronomy, genetics, and material science-via a year-long user-centered design process to develop a VQS that supports their workflow and analytical needs, and evaluate how VQSs can be used in practice. Our study results reveal that ad-hoc sketch-only querying is not as commonly used as prior work suggests, since analysts are often unable to precisely express their patterns of interest. In addition, we characterize three essential sensemaking processes supported by our enhanced VQS. We discover that participants employ all three processes, but in different proportions, depending on the analytical needs in each domain. Our findings suggest that all three sensemaking processes must be integrated in order to make future VQSs useful for a wide range of analytical inquiries.",0.0
10.1109/TVCG.2019.2934667,"['evolution of science', 'disciplines']",[],Galex: Exploring the Evolution and Intersection of Disciplines,"Revealing the evolution of science and the intersections among its sub-fields is extremely important to understand the characteristics of disciplines, discover new topics, and predict the future. The current work focuses on either building the skeleton of science, lacking interaction, detailed exploration and interpretation or on the lower topic level, missing high-level macro-perspective. To fill this gap, we design and implement Galaxy Evolution Explorer (Galex), a hierarchical visual analysis system, in combination with advanced text mining technologies, that could help analysts to comprehend the evolution and intersection of one discipline rapidly. We divide Galex into three progressively fine-grained levels: discipline, area, and institution levels. The combination of interactions enables analysts to explore an arbitrary piece of history and an arbitrary part of the knowledge space of one discipline. Using a flexible spotlight component, analysts could freely select and quickly understand an exploration region. A tree metaphor allows analysts to perceive the expansion, decline, and intersection of topics intuitively. A synchronous spotlight interaction aids in comparing research contents among institutions easily. Three cases demonstrate the effectiveness of our system.",1.0
10.1109/TVCG.2019.2934669,"['code quality', 'software engineering']",['textual explanations'],Exploranative Code Quality Documents,"Good code quality is a prerequisite for efficiently developing maintainable software. In this paper, we present a novel approach to generate exploranative (explanatory and exploratory) data-driven documents that report code quality in an interactive, exploratory environment. We employ a template-based natural language generation method to create textual explanations about the code quality, dependent on data from software metrics. The interactive document is enriched by different kinds of visualization, including parallel coordinates plots and scatterplots for data exploration and graphics embedded into text. We devise an interaction model that allows users to explore code quality with consistent linking between text and visualizations; through integrated explanatory text, users are taught background knowledge about code quality aspects. Our approach to interactive documents was developed in a design study process that included software engineering and visual analytics experts. Although the solution is specific to the software engineering scenario, we discuss how the concept could generalize to multivariate data and report lessons learned in a broader scope.",1.0
10.1109/TVCG.2019.2934670,['air pollution'],['uncertain spatiotemporal propagation processes'],AirVis: Visual Analytics of Air Pollution Propagation,"Air pollution has become a serious public health problem for many cities around the world. To find the causes of air pollution, the propagation processes of air pollutants must be studied at a large spatial scale. However, the complex and dynamic wind fields lead to highly uncertain pollutant transportation. The state-of-the-art data mining approaches cannot fully support the extensive analysis of such uncertain spatiotemporal propagation processes across multiple districts without the integration of domain knowledge. The limitation of these automated approaches motivates us to design and develop AirVis, a novel visual analytics system that assists domain experts in efficiently capturing and interpreting the uncertain propagation patterns of air pollution based on graph visualizations. Designing such a system poses three challenges: a) the extraction of propagation patterns; b) the scalability of pattern presentations; and c) the analysis of propagation processes. To address these challenges, we develop a novel pattern mining framework to model pollutant transportation and extract frequent propagation patterns efficiently from large-scale atmospheric data. Furthermore, we organize the extracted patterns hierarchically based on the minimum description length (MDL) principle and empower expert users to explore and analyze these patterns effectively on the basis of pattern topologies. We demonstrated the effectiveness of our approach through two case studies conducted with a real-world dataset and positive feedback from domain experts.",1.0
10.1109/TVCG.2019.2934671,[],"['visual querying', 'natural-language-based visual query', 'manage uncertain trajectories']",A Natural-language-based Visual Query Approach of Uncertain Human Trajectories,"Visual querying is essential for interactively exploring massive trajectory data. However, the data uncertainty imposes profound challenges to fulfill advanced analytics requirements. On the one hand, many underlying data does not contain accurate geographic coordinates, e.g., positions of a mobile phone only refer to the regions (i.e., mobile cell stations) in which it resides, instead of accurate GPS coordinates. On the other hand, domain experts and general users prefer a natural way, such as using a natural language sentence, to access and analyze massive movement data. In this paper, we propose a visual analytics approach that can extract spatial-temporal constraints from a textual sentence and support an effective query method over uncertain mobile trajectory data. It is built up on encoding massive, spatially uncertain trajectories by the semantic information of the POIs and regions covered by them, and then storing the trajectory documents in text database with an effective indexing scheme. The visual interface facilitates query condition specification, situation-aware visualization, and semantic exploration of large trajectory data. Usage scenarios on real-world human mobility datasets demonstrate the effectiveness of our approach.",0.0
10.1109/VAST47406.2019.8986917,['argumentation mining'],[],VIANA: Visual Interactive Annotation of Argumentation,"Argumentation Mining addresses the challenging tasks of identifying boundaries of argumentative text fragments and extracting their relationships. Fully automated solutions do not reach satisfactory accuracy due to their insufficient incorporation of semantics and domain knowledge. Therefore, experts currently rely on time-consuming manual annotations. In this paper, we present a visual analytics system that augments the manual annotation process by automatically suggesting which text fragments to annotate next. The accuracy of those suggestions is improved over time by incorporating linguistic knowledge and language modeling to learn a measure of argument similarity from user interactions. Based on a long-term collaboration with domain experts, we identify and model five high-level analysis tasks. We enable close reading and note-taking, annotation of arguments, argument reconstruction, extraction of argument relations, and exploration of argument graphs. To avoid context switches, we transition between all views through seamless morphing, visually anchoring all text- and graph-based layers. We evaluate our system with a two-stage expert user study based on a corpus of presidential debates. The results show that experts prefer our system over existing solutions due to the speedup provided by the automatic suggestions and the tight integration between text and graph views.",1.0
10.1109/VAST.2011.6102439,[],"['visual comparison', 'comparison of multiple hierarchies', 'tree comparison']",Interactive visual comparison of multiple trees,"Traditionally, the visual analysis of hierarchies, respectively, trees, is conducted by focusing on one given hierarchy. However, in many research areas multiple, differing hierarchies need to be analyzed simultaneously in a comparative way - in particular to highlight differences between them, which sometimes can be subtle. A prominent example is the analysis of so-called phylogenetic trees in biology, reflecting hierarchical evolutionary relationships among a set of organisms. Typically, the analysis considers multiple phylogenetic trees, either to account for statistical significance or for differences in derivation of such evolutionary hierarchies; for example, based on different input data, such as the 16S ribosomal RNA and protein sequences of highly conserved enzymes. The simultaneous analysis of a collection of such trees leads to more insight into the evolutionary process. We introduce a novel visual analytics approach for the comparison of multiple hierarchies focusing on both global and local structures. A new tree comparison score has been elaborated for the identification of interesting patterns. We developed a set of linked hierarchy views showing the results of automatic tree comparison on various levels of details. This combined approach offers detailed assessment of local and global tree similarities. The approach was developed in close cooperation with experts from the evolutionary biology domain. We apply it to a phylogenetic data set on bacterial ancestry, demonstrating its application benefit.",0.0
10.1109/VAST.2011.6102456,[],"['geotwitter analytics', 'situational awareness', 'geovisual analytics']",SensePlace2: GeoTwitter analytics support for situational awareness,"Geographically-grounded situational awareness (SA) is critical to crisis management and is essential in many other decision making domains that range from infectious disease monitoring, through regional planning, to political campaigning. Social media are becoming an important information input to support situational assessment (to produce awareness) in all domains. Here, we present a geovisual analytics approach to supporting SA for crisis events using one source of social media, Twitter. Specifically, we focus on leveraging explicit and implicit geographic information for tweets, on developing place-time-theme indexing schemes that support overview+detail methods and that scale analytical capabilities to relatively large tweet volumes, and on providing visual interface methods to enable understanding of place, time, and theme components of evolving situations. Our approach is user-centered, using scenario-based design methods that include formal scenarios to guide design and validate implementation as well as a systematic claims analysis to justify design choices and provide a framework for future testing. The work is informed by a structured survey of practitioners and the end product of Phase-I development is demonstrated / validated through implementation in SensePlace2, a map-based, web application initially focused on tweets but extensible to other media.",0.0
10.1109/TVCG.2012.219,"['enterpr ise data analysis', 'industrial data analysis']",[],Enterprise Data Analysis and Visualization: An Interview Study,"Organizations rely on data analysts to model customer engagement, streamline operations, improve production, inform business decisions, and combat fraud. Though numerous analysis and visualization tools have been built to improve the scale and efficiency at which analysts can work, there has been little research on how analysis takes place within the social and organizational context of companies. To better understand the enterprise analysts' ecosystem, we conducted semi-structured interviews with 35 data analysts from 25 organizations across a variety of sectors, including healthcare, retail, marketing and finance. Based on our interview data, we characterize the process of industrial data analysis and document how organizational features of an enterprise impact it. We describe recurring pain points, outstanding challenges, and barriers to adoption for visual analytic tools. Finally, we discuss design implications and opportunities for visual analysis research.",1.0
10.1109/TVCG.2013.200,"['electronic health records', 'medical research']","['event sequence simpliﬁcation', 'event sequences']",Temporal Event Sequence Simplification,"Electronic Health Records (EHRs) have emerged as a cost-effective data source for conducting medical research. The difficulty in using EHRs for research purposes, however, is that both patient selection and record analysis must be conducted across very large, and typically very noisy datasets. Our previous work introduced EventFlow, a visualization tool that transforms an entire dataset of temporal event records into an aggregated display, allowing researchers to analyze population-level patterns and trends. As datasets become larger and more varied, however, it becomes increasingly difficult to provide a succinct, summarizing display. This paper presents a series of user-driven data simplifications that allow researchers to pare event records down to their core elements. Furthermore, we present a novel metric for measuring visual complexity, and a language for codifying disjoint strategies into an overarching simplification framework. These simplifications were used by real-world researchers to gain new and valuable insights from initially overwhelming datasets.",1.0
