doi,domain,problem,title,abstract,label
10.1109/VAST.2010.5652392,[],['dimensionality reduction and analysis'],DimStiller: Workflows for dimensional analysis and reduction,"DimStiller is a system for dimensionality reduction and analysis. It frames the task of understanding and transforming input dimensions as a series of analysis steps where users transform data tables by chaining together different techniques, called operators, into pipelines of expressions. The individual operators have controls and views that are linked together based on the structure of the expression. Users interact with the operator controls to tune parameter choices, with immediate visual feedback guiding the exploration of local neighborhoods of the space of possible data tables. DimStiller also provides global guidance for navigating data-table space through expression templates called workflows, which permit re-use of common patterns of analysis.",0.0
10.1109/VAST.2010.5652398,[],"['risk assessment', 'decision making']",Visual exploration of classification models for risk assessment,"In risk assessment applications well informed decisions are made based on huge amounts of multi-dimensional data. In many domains not only the risk of a wrong decision, but in particular the trade-off between the costs of possible decisions are of utmost importance. In this paper we describe a framework tightly integrating interactive visual exploration with machine learning to support the decision making process. The proposed approach uses a series of interactive 2D visualizations of numeric and ordinal data combined with visualization of classification models. These series of visual elements are further linked to the classifier's performance visualized using an interactive performance curve. An interactive decision point on the performance curve allows the decision maker to steer the classification model and instantly identify the critical, cost changing data elements, in the various linked visualizations. The critical data elements are represented as images in order to trigger associations related to the knowledge of the expert. In this context the data visualization and classification results are not only linked together, but are also linked back to the classification model. Such a visual analytics framework allows the user to interactively explore the costs of his decisions for different settings of the model and accordingly use the most suitable classification model and make more informed and reliable decisions. A case study on data from the Forensic Psychiatry domain reveals the usefulness of the suggested approach.",0.0
10.1109/VAST.2010.5652443,[],['classiﬁcation'],iVisClassifier: An interactive visual analytics system for classification based on supervised dimension reduction,"We present an interactive visual analytics system for classification, iVisClassifier, based on a supervised dimension reduction method, linear discriminant analysis (LDA). Given high-dimensional data and associated cluster labels, LDA gives their reduced dimensional representation, which provides a good overview about the cluster structure. Instead of a single two- or three-dimensional scatter plot, iVisClassifier fully interacts with all the reduced dimensions obtained by LDA through parallel coordinates and a scatter plot. Furthermore, it significantly improves the interactivity and interpretability of LDA. LDA enables users to understand each of the reduced dimensions and how they influence the data by reconstructing the basis vector into the original data domain. By using heat maps, iVisClassifier gives an overview about the cluster relationship in terms of pairwise distances between cluster centroids both in the original space and in the reduced dimensional space. Equipped with these functionalities, iVisClassifier supports users' classification tasks in an efficient way. Using several facial image data, we show how the above analysis is performed.",0.0
10.1109/VAST.2010.5652450,['astronomy'],"['subspace clustering', 'clustering high-dimensional data']",Finding and visualizing relevant subspaces for clustering high-dimensional astronomical data using connected morphological operators,"Data sets in astronomy are growing to enormous sizes. Modern astronomical surveys provide not only image data but also catalogues of millions of objects (stars, galaxies), each object with hundreds of associated parameters. Exploration of this very high-dimensional data space poses a huge challenge. Subspace clustering is one among several approaches which have been proposed for this purpose in recent years. However, many clustering algorithms require the user to set a large number of parameters without any guidelines. Some methods also do not provide a concise summary of the datasets, or, if they do, they lack additional important information such as the number of clusters present or the significance of the clusters. In this paper, we propose a method for ranking subspaces for clustering which overcomes many of the above limitations. First we carry out a transformation from parametric space to discrete image space where the data are represented by a grid-based density field. Then we apply so-called connected morphological operators on this density field of astronomical objects that provides visual support for the analysis of the important subspaces. Clusters in subspaces correspond to high-intensity regions in the density image. The importance of a cluster is measured by a new quality criterion based on the dynamics of local maxima of the density. Connected operators are able to extract such regions with an indication of the number of clusters present. The subspaces are visualized during computation of the quality measure, so that the user can interact with the system to improve the results. In the result stage, we use three visualization toolkits linked within a graphical user interface so that the user can perform an in-depth exploration of the ranked subspaces. Evaluation based on synthetic as well as real astronomical datasets demonstrates the power of the new method. We recover various known astronomical relations directly from the data with little or no a pri...",1.0
10.1109/VAST.2010.5652467,[],"['anomaly detection', 'gps anomaly detection']",Anomaly detection in GPS data based on visual analytics,"Modern machine learning techniques provide robust approaches for data-driven modeling and critical information extraction, while human experts hold the advantage of possessing high-level intelligence and domain-specific expertise. We combine the power of the two for anomaly detection in GPS data by integrating them through a visualization and human-computer interaction interface. In this paper we introduce GPSvas (GPS Visual Analytics System), a system that detects anomalies in GPS data using the approach of visual analytics: a conditional random field (CRF) model is used as the machine learning component for anomaly detection in streaming GPS traces. A visualization component and an interactive user interface are built to visualize the data stream, display significant analysis results (i.e., anomalies or uncertain predications) and hidden information extracted by the anomaly detection model, which enable human experts to observe the real-time data behavior and gain insights into the data flow. Human experts further provide guidance to the machine learning model through the interaction tools; the learning model is then incrementally improved through an active learning procedure.",0.0
10.1109/VAST.2010.5652478,"[""people's activity traces"", 'activity trace']","['geocomputations', 'geovisualizations', 'event detection']",Discovering bits of place histories from people's activity traces,"Events that happened in the past are important for understanding the ongoing processes, predicting future developments, and making informed decisions. Significant and/or interesting events tend to attract many people. Some people leave traces of their attendance in the form of computer-processable data, such as records in the databases of mobile phone operators or photos on photo sharing web sites. We developed a suite of visual analytics methods for reconstructing past events from these activity traces. Our tools combine geocomputations, interactive geovisualizations and statistical methods to enable integrated analysis of the spatial, temporal, and thematic components of the data, including numeric attributes and texts. We demonstrate the utility of our approach on two large real data sets, mobile phone calls in Milano during 9 days and flickr photos made on British Isles during 5 years.",1.0
10.1109/VAST.2010.5652484,[],"['model learning', 'sequence segmentation', 'hidden  markov model']",A visual analytics approach to model learning,"The process of learning models from raw data typically requires a substantial amount of user input during the model initialization phase. We present an assistive visualization system which greatly reduces the load on the users and makes the process of model initialization and refinement more efficient, problem-driven, and engaging. Utilizing a sequence segmentation task with a Hidden Markov Model as an example, we assign each token in the sequence a feature vector based on its various properties within the sequence. These vectors are then clustered according to similarity, generating a layout of the individual tokens in form of a node link diagram where the length of the links is determined by the feature vector similarity. Users may then tune the weights of the feature vector components to improve the segmentation, which is visualized as a better separation of the clusters. Also, as individual clusters represent different classes, the user can now work at the cluster level to define token classes, instead of labelling one entry at time. Inconsistent entries visually identify themselves by locating at the periphery of clusters, and the user then helps refine the model by resolving these inconsistencies. Our system therefore makes efficient use of the knowledge of its users, only requesting user assistance for non-trivial data items. It so allows users to visually analyse data at a higher, more abstract level, improving scalability.",0.0
10.1109/VAST.2010.5652926,"['visual readability analysis', 'visual readability analysis', 'readability of a sentence', 'revising a text']",[],Visual readability analysis: How to make your writings easier to read,"We present a tool that is specifically designed to support a writer in revising a draft-version of a document. In addition to showing which paragraphs and sentences are difficult to read and understand, we assist the reader in understanding why this is the case. This requires features that are expressive predictors of readability, and are also semantically understandable. In the first part of the paper, we therefore discuss a semi-automatic feature selection approach that is used to choose appropriate measures from a collection of 141 candidate readability features. In the second part, we present the visual analysis tool VisRA, which allows the user to analyze the feature values across the text and within single sentences. The user can choose different visual representations accounting for differences in the size of the documents and the availability of information about the physical and logical layout of the documents. We put special emphasis on providing as much transparency as possible to ensure that the user can purposefully improve the readability of a sentence. Several case-studies are presented that show the wide range of applicability of our tool.",1.0
10.1109/VAST.2012.6400558,"['social  network', 'social  network  analysis']",['sensemaking'],SocialNetSense: Supporting sensemaking of social and structural features in networks with interactive visualization,"Increasingly, social network datasets contain social attribute information about actors and their relationship. Analyzing such network with social attributes requires making sense of not only its structural features, but also the relationship between social features in attributes and network structures. Existing social network analysis tools are usually weak in supporting complex analytical tasks involving both structural and social features, and often overlook users' needs for sensemaking tools that help to gather, synthesize, and organize information of these features. To address these challenges, we propose a sensemaking framework of social-network visual analytics in this paper. This framework considers both bottom-up processes, which are about constructing new understandings based on collected information, and top-down processes, which concern using prior knowledge to guide information collection, in analyzing social networks from both social and structural perspectives. The framework also emphasizes the externalization of sensemaking processes through interactive visualization. Guided by the framework, we develop a system, SocialNetSense, to support the sensemaking in visual analytics of social networks with social attributes. The example of using our system to analyze a scholar collaboration network shows that our approach can help users gain insight into social networks both structurally and socially, and enhance their process awareness in visual analytics.",1.0
10.1109/TVCG.2013.146,[],"['operational decision management', 'decision-making']",Decision Exploration Lab: A Visual Analytics Solution for Decision Management,"We present a visual analytics solution designed to address prevalent issues in the area of Operational Decision Management (ODM). In ODM, which has its roots in Artificial Intelligence (Expert Systems) and Management Science, it is increasingly important to align business decisions with business goals. In our work, we consider decision models (executable models of the business domain) as ontologies that describe the business domain, and production rules that describe the business logic of decisions to be made over this ontology. Executing a decision model produces an accumulation of decisions made over time for individual cases. We are interested, first, to get insight in the decision logic and the accumulated facts by themselves. Secondly and more importantly, we want to see how the accumulated facts reveal potential divergences between the reality as captured by the decision model, and the reality as captured by the executed decisions. We illustrate the motivation, added value for visual analytics, and our proposed solution and tooling through a business case from the car insurance industry.",0.0
10.1109/TVCG.2013.168,['surveillance video'],['video visual  analytics'],Interactive Exploration of Surveillance Video through Action Shot Summarization and Trajectory Visualization,"We propose a novel video visual analytics system for interactive exploration of surveillance video data. Our approach consists of providing analysts with various views of information related to moving objects in a video. To do this we first extract each object's movement path. We visualize each movement by (a) creating a single action shot image (a still image that coalesces multiple frames), (b) plotting its trajectory in a space-time cube and (c) displaying an overall timeline view of all the movements. The action shots provide a still view of the moving object while the path view presents movement properties such as speed and location. We also provide tools for spatial and temporal filtering based on regions of interest. This allows analysts to filter out large amounts of movement activities while the action shot representation summarizes the content of each movement. We incorporated this multi-part visual representation of moving objects in sViSIT, a tool to facilitate browsing through the video content by interactive querying and retrieval of data. Based on our interaction with security personnel who routinely interact with surveillance video data, we identified some of the most common tasks performed. This resulted in designing a user study to measure time-to-completion of the various tasks. These generally required searching for specific events of interest (targets) in videos. Fourteen different tasks were designed and a total of 120 min of surveillance video were recorded (indoor and outdoor locations recording movements of people and vehicles). The time-to-completion of these tasks were compared against a manual fast forward video browsing guided with movement detection. We demonstrate how our system can facilitate lengthy video exploration and significantly reduce browsing time to find events of interest. Reports from expert users identify positive aspects of our approach which we summarize in our recommendations for future video visual analytics systems.",1.0
10.1109/TVCG.2013.212,[],"['topic modeling', 'visual text analytics']",UTOPIAN: User-Driven Topic Modeling Based on Interactive Nonnegative Matrix Factorization,"Topic modeling has been widely used for analyzing text document collections. Recently, there have been significant advancements in various topic modeling techniques, particularly in the form of probabilistic graphical modeling. State-of-the-art techniques such as Latent Dirichlet Allocation (LDA) have been successfully applied in visual text analytics. However, most of the widely-used methods based on probabilistic modeling have drawbacks in terms of consistency from multiple runs and empirical convergence. Furthermore, due to the complicatedness in the formulation and the algorithm, LDA cannot easily incorporate various types of user feedback. To tackle this problem, we propose a reliable and flexible visual analytics system for topic modeling called UTOPIAN (User-driven Topic modeling based on Interactive Nonnegative Matrix Factorization). Centered around its semi-supervised formulation, UTOPIAN enables users to interact with the topic modeling method and steer the result in a user-driven manner. We demonstrate the capability of UTOPIAN via several usage scenarios with real-world document corpuses such as InfoVis/VAST paper data set and product review data sets.",0.0
10.1109/TVCG.2013.222,[],"['model selection', 'time series analysis']",Visual Analytics for Model Selection in Time Series Analysis,"Model selection in time series analysis is a challenging task for domain experts in many application areas such as epidemiology, economy, or environmental sciences. The methodology used for this task demands a close combination of human judgement and automated computation. However, statistical software tools do not adequately support this combination through interactive visual interfaces. We propose a Visual Analytics process to guide domain experts in this task. For this purpose, we developed the TiMoVA prototype that implements this process based on user stories and iterative expert feedback on user experience. The prototype was evaluated by usage scenarios with an example dataset from epidemiology and interviews with two external domain experts in statistics. The insights from the experts' feedback and the usage scenarios show that TiMoVA is able to support domain experts in model selection tasks through interactive visual interfaces with short feedback cycles.",0.0
10.1109/TVCG.2014.2346660,[],"['multi-class classiﬁers', 'probabilistic classiﬁcation', 'multi-class classiﬁcation']",Visual Methods for Analyzing Probabilistic Classification Data,"Multi-class classifiers often compute scores for the classification samples describing probabilities to belong to different classes. In order to improve the performance of such classifiers, machine learning experts need to analyze classification results for a large number of labeled samples to find possible reasons for incorrect classification. Confusion matrices are widely used for this purpose. However, they provide no information about classification scores and features computed for the samples. We propose a set of integrated visual methods for analyzing the performance of probabilistic classifiers. Our methods provide insight into different aspects of the classification results for a large number of samples. One visualization emphasizes at which probabilities these samples were classified and how these probabilities correlate with classification error in terms of false positives and false negatives. Another view emphasizes the features of these samples and ranks them by their separation power between selected true and false classifications. We demonstrate the insight gained using our technique in a benchmarking classification dataset, and show how it enables improving classification performance by interactively defining and evaluating post-classification rules.",0.0
10.1109/TVCG.2014.2346744,[],"['simulation ensembles', 'complex engineering systems']",Visual Analytics for Complex Engineering Systems: Hybrid Visual Steering of Simulation Ensembles,"In this paper we propose a novel approach to hybrid visual steering of simulation ensembles. A simulation ensemble is a collection of simulation runs of the same simulation model using different sets of control parameters. Complex engineering systems have very large parameter spaces so a naïve sampling can result in prohibitively large simulation ensembles. Interactive steering of simulation ensembles provides the means to select relevant points in a multi-dimensional parameter space (design of experiment). Interactive steering efficiently reduces the number of simulation runs needed by coupling simulation and visualization and allowing a user to request new simulations on the fly. As system complexity grows, a pure interactive solution is not always sufficient. The new approach of hybrid steering combines interactive visual steering with automatic optimization. Hybrid steering allows a domain expert to interactively (in a visualization) select data points in an iterative manner, approximate the values in a continuous region of the simulation space (by regression) and automatically find the “best” points in this continuous region based on the specified constraints and objectives (by optimization). We argue that with the full spectrum of optimization options, the steering process can be improved substantially. We describe an integrated system consisting of a simulation, a visualization, and an optimization component. We also describe typical tasks and propose an interactive analysis workflow for complex engineering systems. We demonstrate our approach on a case study from automotive industry, the optimization of a hydraulic circuit in a high pressure common rail Diesel injection system.",0.0
10.1109/TVCG.2014.2346753,"['transcriptional regulatory networks', 'genomic technologies', 'computational biology', 'gene regulatory networks']",[],Genotet: An Interactive Web-based Visual Exploration Framework to Support Validation of Gene Regulatory Networks,"Elucidation of transcriptional regulatory networks (TRNs) is a fundamental goal in biology, and one of the most important components of TRNs are transcription factors (TFs), proteins that specifically bind to gene promoter and enhancer regions to alter target gene expression patterns. Advances in genomic technologies as well as advances in computational biology have led to multiple large regulatory network models (directed networks) each with a large corpus of supporting data and gene-annotation. There are multiple possible biological motivations for exploring large regulatory network models, including: validating TF-target gene relationships, figuring out co-regulation patterns, and exploring the coordination of cell processes in response to changes in cell state or environment. Here we focus on queries aimed at validating regulatory network models, and on coordinating visualization of primary data and directed weighted gene regulatory networks. The large size of both the network models and the primary data can make such coordinated queries cumbersome with existing tools and, in particular, inhibits the sharing of results between collaborators. In this work, we develop and demonstrate a web-based framework for coordinating visualization and exploration of expression data (RNA-seq, microarray), network models and gene-binding data (ChIP-seq). Using specialized data structures and multiple coordinated views, we design an efficient querying model to support interactive analysis of the data. Finally, we show the effectiveness of our framework through case studies for the mouse immune system (a dataset focused on a subset of key cellular functions) and a model bacteria (a small genome with high data-completeness).",1.0
