doi,domain,problem,title,abstract,label
10.1109/TVCG.2017.2744718,[],"['deep learning', 'deep neural network']",ActiVis: Visual Exploration of Industry-Scale Deep Neural Network Models,"While deep learning models have achieved state-of-the-art accuracies for many prediction tasks, understanding these models remains a challenge. Despite the recent interest in developing visual tools to help users interpret deep learning models, the complexity and wide variety of models deployed in industry, and the large-scale datasets that they used, pose unique design challenges that are inadequately addressed by existing work. Through participatory design sessions with over 15 researchers and engineers at Facebook, we have developed, deployed, and iteratively improved ActiVis, an interactive visualization system for interpreting large-scale deep learning models and results. By tightly integrating multiple coordinated views, such as a computation graph overview of the model architecture, and a neuron activation view for pattern discovery and comparison, users can explore complex deep neural network models at both the instance-and subset-level. ActiVis has been deployed on Facebook's machine learning platform. We present case studies with Facebook researchers and engineers, and usage scenarios of how ActiVis may work with different models.",0.0
10.1109/TVCG.2017.2745080,[],"['topic modeling', 'topic model conﬁguration']",Progressive Learning of Topic Modeling Parameters: A Visual Analytics Framework,"Topic modeling algorithms are widely used to analyze the thematic composition of text corpora but remain difficult to interpret and adjust. Addressing these limitations, we present a modular visual analytics framework, tackling the understandability and adaptability of topic models through a user-driven reinforcement learning process which does not require a deep understanding of the underlying topic modeling algorithms. Given a document corpus, our approach initializes two algorithm configurations based on a parameter space analysis that enhances document separability. We abstract the model complexity in an interactive visual workspace for exploring the automatic matching results of two models, investigating topic summaries, analyzing parameter distributions, and reviewing documents. The main contribution of our work is an iterative decision-making technique in which users provide a document-based relevance feedback that allows the framework to converge to a user-endorsed topic distribution. We also report feedback from a two-stage study which shows that our technique results in topic model quality improvements on two independent measures.",0.0
10.1109/TVCG.2017.2745158,[],"['decision trees', 'model selection', 'sensitivity analysis']",TreePOD: Sensitivity-Aware Selection of Pareto-Optimal Decision Trees,"Balancing accuracy gains with other objectives such as interpretability is a key challenge when building decision trees. However, this process is difficult to automate because it involves know-how about the domain as well as the purpose of the model. This paper presents TreePOD, a new approach for sensitivity-aware model selection along trade-offs. TreePOD is based on exploring a large set of candidate trees generated by sampling the parameters of tree construction algorithms. Based on this set, visualizations of quantitative and qualitative tree aspects provide a comprehensive overview of possible tree characteristics. Along trade-offs between two objectives, TreePOD provides efficient selection guidance by focusing on Pareto-optimal tree candidates. TreePOD also conveys the sensitivities of tree characteristics on variations of selected parameters by extending the tree generation process with a full-factorial sampling. We demonstrate how TreePOD supports a variety of tasks involved in decision tree selection and describe its integration in a holistic workflow for building and selecting decision trees. For evaluation, we illustrate a case study for predicting critical power grid states, and we report qualitative feedback from domain experts in the energy sector. This feedback suggests that TreePOD enables users with and without statistical background a confident and efficient identification of suitable decision trees.",0.0
10.1109/TVCG.2017.2745279,[],"['collaborative analysis', 'authoring of handoff annotations', 'sensemaking', 'structured externalizations']",Supporting Handoff in Asynchronous Collaborative Sensemaking Using Knowledge-Transfer Graphs,"During asynchronous collaborative analysis, handoff of partial findings is challenging because externalizations produced by analysts may not adequately communicate their investigative process. To address this challenge, we developed techniques to automatically capture and help encode tacit aspects of the investigative process based on an analyst's interactions, and streamline explicit authoring of handoff annotations. We designed our techniques to mediate awareness of analysis coverage, support explicit communication of progress and uncertainty with annotation, and implicit communication through playback of investigation histories. To evaluate our techniques, we developed an interactive visual analysis system, KTGraph, that supports an asynchronous investigative document analysis task. We conducted a two-phase user study to characterize a set of handoff strategies and to compare investigative performance with and without our techniques. The results suggest that our techniques promote the use of more effective handoff strategies, help increase an awareness of prior investigative process and insights, as well as improve final investigative outcomes.",0.0
10.1109/VAST.2017.8585505,"['medieval text traditions', 'textual criticism', 'literary scholarship']",[],Interactive Visual Alignment of Medieval Text Versions,"Textual criticism consists of the identification and analysis of variant readings among different versions of a text. Being a relatively simple task for modern languages, the collation of medieval text traditions ranges from the complex to the virtually impossible depending on the degree of instability of textual transmission. We present a visual analytics environment that supports computationally aligning such complex textual differences typical of orally inflected medieval poetry. For the purpose of analyzing alignment, we provide interactive visualizations for different text hierarchy levels, specifically, a meso reading view to support investigating repetition and variance at the line level across text segments. In addition to outlining important aspects of our interdisciplinary collaboration, we emphasize the utility of the proposed system by various usage scenarios in medieval French literature.",1.0
10.1109/VAST.2017.8585647,[],"['causal inference', 'visual causality analysis']",Visual Causality Analysis Made Practical,"Deriving the exact casual model that governs the relations between variables in a multidimensional dataset is difficult in practice. It is because causal inference algorithms by themselves typically cannot encode an adequate amount of domain knowledge to break all ties. Visual analytic approaches are considered a feasible alternative to fully automated methods. However, their application in real-world scenarios can be tedious. This paper focuses on these practical aspects of visual causality analysis. The most imperative of these aspects is posed by Simpson' Paradox. It implies the existence of multiple causal models differing in both structure and parameter depending on how the data is subdivided. We propose a comprehensive interface that engages human experts in identifying these subdivisions and allowing them to establish the corresponding causal models via a rich set of interactive facilities. Other features of our interface include: (1) a new causal network visualization that emphasizes the flow of causal dependencies, (2) a model scoring mechanism with visual hints for interactive model refinement, and (3) flexible approaches for handling heterogeneous data. Various real-world data examples are given.",0.0
10.1109/VAST.2017.8585733,['question-answering (qa) systems'],['evaluation analysis'],QSAnglyzer: Visual Analytics for Prismatic Analysis of Question Answering System Evaluations,"Developing sophisticated artificial intelligence (AI) systems requires AI researchers to experiment with different designs and analyze results from evaluations (we refer this task as evaluation analysis). In this paper, we tackle the challenges of evaluation analysis in the domain of question-answering (QA) systems. Through in-depth studies with QA researchers, we identify tasks and goals of evaluation analysis and derive a set of design rationales, based on which we propose a novel approach termed prismatic analysis. Prismatic analysis examines data through multiple ways of categorization (referred as angles). Categories in each angle are measured by aggregate metrics to enable diverse comparison scenarios. To facilitate prismatic analysis of QA evaluations, we design and implement the Question Space Anglyzer (QSAnglyzer), a visual analytics (VA) tool. In QSAnglyzer, the high-dimensional space formed by questions is divided into categories based on several angles (e.g., topic and question type). Each category is aggregated by accuracy, the number of questions, and accuracy variance across evaluations. QSAnglyzer visualizes these angles so that QA researchers can examine and compare evaluations from various aspects both individually and collectively. Furthermore, QA researchers filter questions based on any angle by clicking to construct complex queries. We validate QSAnglyzer through controlled experiments and by expert reviews. The results indicate that when using QSAnglyzer, users perform analysis tasks faster (p <; 0.01) and more accurately (p <; 0.05), and are quick to gain new insight. We discuss how prismatic analysis and QSAnglyzer scaffold evaluation analysis, and provide directions for future research.",1.0
10.1109/TVCG.2018.2864504,[],"['deep q-network', 'deep reinforcement learning']",DQNViz: A Visual Analytics Approach to Understand Deep Q-Networks,"Deep Q-Network (DQN), as one type of deep reinforcement learning model, targets to train an intelligent agent that acquires optimal actions while interacting with an environment. The model is well known for its ability to surpass professional human players across many Atari 2600 games. Despite the superhuman performance, in-depth understanding of the model and interpreting the sophisticated behaviors of the DQN agent remain to be challenging tasks, due to the long-time model training process and the large number of experiences dynamically generated by the agent. In this work, we propose DQNViz, a visual analytics system to expose details of the blind training process in four levels, and enable users to dive into the large experience space of the agent for comprehensive analysis. As an initial attempt in visualizing DQN models, our work focuses more on Atari games with a simple action space, most notably the Breakout game. From our visual analytics of the agent's experiences, we extract useful action/reward patterns that help to interpret the model and control the training. Through multiple case studies conducted together with deep learning experts, we demonstrate that DQNViz can effectively help domain experts to understand, diagnose, and potentially improve DQN models.",0.0
10.1109/TVCG.2018.2864825,[],"['anomaly detection', 'ensemble analysis']",EnsembleLens: Ensemble-based Visual Exploration of Anomaly Detection Algorithms with Multidimensional Data,"The results of anomaly detection are sensitive to the choice of detection algorithms as they are specialized for different properties of data, especially for multidimensional data. Thus, it is vital to select the algorithm appropriately. To systematically select the algorithms, ensemble analysis techniques have been developed to support the assembly and comparison of heterogeneous algorithms. However, challenges remain due to the absence of the ground truth, interpretation, or evaluation of these anomaly detectors. In this paper, we present a visual analytics system named EnsembleLens that evaluates anomaly detection algorithms based on the ensemble analysis process. The system visualizes the ensemble processes and results by a set of novel visual designs and multiple coordinated contextual views to meet the requirements of correlation analysis, assessment and reasoning of anomaly detection algorithms. We also introduce an interactive analysis workflow that dynamically produces contextualized and interpretable data summaries that allow further refinements of exploration results based on user feedback. We demonstrate the effectiveness of EnsembleLens through a quantitative evaluation, three case studies with real-world data and interviews with two domain experts.",0.0
10.1109/TVCG.2018.2865029,['cyber security analysts'],"['discovering suspicious behavior', 'anomaly detection']",Situ: Identifying and Explaining Suspicious Behavior in Networks,"Despite the best efforts of cyber security analysts, networked computing assets are routinely compromised, resulting in the loss of intellectual property, the disclosure of state secrets, and major financial damages. Anomaly detection methods are beneficial for detecting new types of attacks and abnormal network activity, but such algorithms can be difficult to understand and trust. Network operators and cyber analysts need fast and scalable tools to help identify suspicious behavior that bypasses automated security systems, but operators do not want another automated tool with algorithms they do not trust. Experts need tools to augment their own domain expertise and to provide a contextual understanding of suspicious behavior to help them make decisions. In this paper we present Situ, a visual analytics system for discovering suspicious behavior in streaming network data. Situ provides a scalable solution that combines anomaly detection with information visualization. The system's visualizations enable operators to identify and investigate the most anomalous events and IP addresses, and the tool provides context to help operators understand why they are anomalous. Finally, operators need tools that can be integrated into their workflow and with their existing tools. This paper describes the Situ platform and its deployment in an operational network setting. We discuss how operators are currently using the tool in a large organization's security operations center and present the results of expert reviews with professionals.",1.0
10.1109/TVCG.2018.2865043,['clinical biostatistics'],['logistic regression'],RegressionExplorer: Interactive Exploration of Logistic Regression Models with Subgroup Analysis,"We present RegressionExplorer, a Visual Analytics tool for the interactive exploration of logistic regression models. Our application domain is Clinical Biostatistics, where models are derived from patient data with the aim to obtain clinically meaningful insights and consequences. Development and interpretation of a proper model requires domain expertise and insight into model characteristics. Because of time constraints, often a limited number of candidate models is evaluated. RegressionExplorer enables experts to quickly generate, evaluate, and compare many different models, taking the workflow for model development as starting point. Global patterns in parameter values of candidate models can be explored effectively. In addition, experts are enabled to compare candidate models across multiple subpopulations. The insights obtained can be used to formulate new hypotheses or to steer model development. The effectiveness of the tool is demonstrated for two uses cases: prediction of a cardiac conduction disorder in patients after receiving a heart valve implant and prediction of hypernatremia in critically ill patients.",1.0
10.1109/VAST.2018.8802383,['online distance education'],"['video utilization', 'educational video analysis']",VUSphere: Visual Analysis of Video Utilization in Online Distance Education,"Online Distance Education (ODE) provides massive course videos of various specialties for students across the country to learn professional knowledge anytime and anywhere. Analyzing the utilization of these videos from user log data can help academics better understand the learning process of students, evaluate the quality of service provided by regional learning centers, and improve the quality of program curriculum in the future. However, due to the lack of comparable indicators, it is a great challenge to discover the utilization patterns of massive videos and analyze the learning process of large-scale student population from learning log data. In this paper, we introduce a visual analytics system, called VUSphere, to explore the video utilization from multiple perspectives with two proposed indicators. This system offers three coordinated views: a spherical layout overview to depict the overall utilization distribution of videos, courses, and students; a detailed statistics view with four panels to present video utilization statistics of each element from multiple perspectives; and a comparison view to examine the differences in individual elements. Based on the real dataset from our ODE school, several patterns related to video utilization and enrollment are found in the case study with our domain experts.",1.0
10.1109/VAST.2018.8802509,[],"['deep neural networks', 'adversarial examples']",Analyzing the Noise Robustness of Deep Neural Networks,"Deep neural networks (DNNs) are vulnerable to maliciously generated adversarial examples. These examples are intentionally designed by making imperceptible perturbations and often mislead a DNN into making an incorrect prediction. This phenomenon means that there is significant risk in applying DNNs to safety-critical applications, such as driverless cars. To address this issue, we present a visual analytics approach to explain the primary cause of the wrong predictions introduced by adversarial examples. The key is to analyze the datapaths of the adversarial examples and compare them with those of the normal examples. A datapath is a group of critical neurons and their connections. To this end, we formulate the datapath extraction as a subset selection problem and approximately solve it based on back-propagation. A multi-level visualization consisting of a segmented DAG (layer level), an Euler diagram (feature map level), and a heat map (neuron level), has been designed to help experts investigate datapaths from the high-level layers to the detailed neuron activations. Two case studies are conducted that demonstrate the promise of our approach in support of explaining the working mechanism of adversarial examples.",0.0
10.1109/TVCG.2019.2934261,[],"['deep learning', 'model building']","Ablate, Variate, and Contemplate: Visual Analytics for Discovering Neural Architectures","The performance of deep learning models is dependent on the precise configuration of many layers and parameters. However, there are currently few systematic guidelines for how to configure a successful model. This means model builders often have to experiment with different configurations by manually programming different architectures (which is tedious and time consuming) or rely on purely automated approaches to generate and train the architectures (which is expensive). In this paper, we present Rapid Exploration of Model Architectures and Parameters, or REMAP, a visual analytics tool that allows a model builder to discover a deep learning model quickly via exploration and rapid experimentation of neural network architectures. In REMAP, the user explores the large and complex parameter space for neural network architectures using a combination of global inspection and local experimentation. Through a visual overview of a set of models, the user identifies interesting clusters of architectures. Based on their findings, the user can run ablation and variation experiments to identify the effects of adding, removing, or replacing layers in a given architecture and generate new models accordingly. They can also handcraft new models using a simple graphical interface. As a result, a model builder can build deep learning models quickly, efficiently, and without manual programming. We inform the design of REMAP through a design study with four deep learning model builders. Through a use case, we demonstrate that REMAP allows users to discover performant neural network architectures efficiently using visual exploration and user-defined semi-automated searches through the model space.",0.0
10.1109/TVCG.2019.2934267,[],"['deep sequence models', 'steer the model']",ProtoSteer: Steering Deep Sequence Model with Prototypes,"Recently we have witnessed growing adoption of deep sequence models (e.g. LSTMs) in many application domains, including predictive health care, natural language processing, and log analysis. However, the intricate working mechanism of these models confines their accessibility to the domain experts. Their black-box nature also makes it a challenging task to incorporate domain-specific knowledge of the experts into the model. In ProtoSteer (Prototype Steering), we tackle the challenge of directly involving the domain experts to steer a deep sequence model without relying on model developers as intermediaries. Our approach originates in case-based reasoning, which imitates the common human problem-solving process of consulting past experiences to solve new problems. We utilize ProSeNet (Prototype Sequence Network), which learns a small set of exemplar cases (i.e., prototypes) from historical data. In ProtoSteer they serve both as an efficient visual summary of the original data and explanations of model decisions. With ProtoSteer the domain experts can inspect, critique, and revise the prototypes interactively. The system then incorporates user-specified prototypes and incrementally updates the model. We conduct extensive case studies and expert interviews in application domains including sentiment analysis on texts and predictive diagnostics based on vehicle fault logs. The results demonstrate that involvements of domain users can help obtain more interpretable models with concise prototypes while retaining similar accuracy.",0.0
10.1109/TVCG.2019.2934307,[],"['t-distributed stochastic neighbor embedding', 't-sne', 't-sne minimization problem']",GPGPU Linear Complexity t-SNE Optimization,"In recent years the t-distributed Stochastic Neighbor Embedding (t-SNE) algorithm has become one of the most used and insightful techniques for exploratory data analysis of high-dimensional data. It reveals clusters of high-dimensional data points at different scales while only requiring minimal tuning of its parameters. However, the computational complexity of the algorithm limits its application to relatively small datasets. To address this problem, several evolutions of t-SNE have been developed in recent years, mainly focusing on the scalability of the similarity computations between data points. However, these contributions are insufficient to achieve interactive rates when visualizing the evolution of the t-SNE embedding for large datasets. In this work, we present a novel approach to the minimization of the t-SNE objective function that heavily relies on graphics hardware and has linear computational complexity. Our technique decreases the computational cost of running t-SNE on datasets by orders of magnitude and retains or improves on the accuracy of past approximated techniques. We propose to approximate the repulsive forces between data points by splatting kernel textures for each data point. This approximation allows us to reformulate the t-SNE minimization problem as a series of tensor operations that can be efficiently executed on the graphics card. An efficient implementation of our technique is integrated and available for use in the widely used Google TensorFlow.js, and an open-source C++ library.",0.0
10.1109/TVCG.2019.2934655,['radio monitoring and management'],['electromagnetic situation awareness'],Visual Analytics for Electromagnetic Situation Awareness in Radio Monitoring and Management,"Traditional radio monitoring and management largely depend on radio spectrum data analysis, which requires considerable domain experience and heavy cognition effort and frequently results in incorrect signal judgment and incomprehensive situation awareness. Faced with increasingly complicated electromagnetic environments, radio supervisors urgently need additional data sources and advanced analytical technologies to enhance their situation awareness ability. This paper introduces a visual analytics approach for electromagnetic situation awareness. Guided by a detailed scenario and requirement analysis, we first propose a signal clustering method to process radio signal data and a situation assessment model to obtain qualitative and quantitative descriptions of the electromagnetic situations. We then design a two-module interface with a set of visualization views and interactions to help radio supervisors perceive and understand the electromagnetic situations by a joint analysis of radio signal data and radio spectrum data. Evaluations on real-world data sets and an interview with actual users demonstrate the effectiveness of our prototype system. Finally, we discuss the limitations of the proposed approach and provide future work directions.",1.0
